### ISSUE TITLE
HTTP PUT 307 redirect is incorreclty handled to the HTTP GET request

### ISSUE THREAD

**Issue by ymote** [visionmedia/superagent#317]
The 307 redirect the PUT to GET. Happened in version 0.16.0.

client --PUT--> server:5001
server --307--> client
client --GET--> server:5002

No.     Time           Source                Destination           Protocol Length Info
     24 4.521733000    192.168.1.130         10.10.0.15       HTTP     420    PUT /v2/keys/runners/b2b2 HTTP/1.1  (application/x-www-form-urlencoded)

Frame 24: 420 bytes on wire (3360 bits), 420 bytes captured (3360 bits) on interface 0
Ethernet II, Src: Apple_7f:7d:30 (10:40:f3:7f:7d:30), Dst: Cisco-Li_72:7e:65 (20:aa:4b:72:7e:65)
Internet Protocol Version 4, Src: 192.168.1.130 (192.168.1.130), Dst: 10.10.0.15 (10.10.0.15)
Transmission Control Protocol, Src Port: 52369 (52369), Dst Port: commplex-link (5001), Seq: 1, Ack: 1, Len: 354
Hypertext Transfer Protocol
    PUT /v2/keys/runners/b2b2 HTTP/1.1\r\n
        [Expert Info (Chat/Sequence): PUT /v2/keys/runners/b2b2 HTTP/1.1\r\n]
        Request Method: PUT
        Request URI: /v2/keys/runners/b2b2
        Request Version: HTTP/1.1
    Host: etcd.example.com.com:5001\r\n
    Accept-Encoding: gzip, deflate\r\n
    Cookie: \r\n
    Content-Type: application/x-www-form-urlencoded\r\n
    Content-Length: 154\r\n
    Connection: close\r\n
    \r\n
    [Full request URI: http://etcd.example.com.com:5001/v2/keys/runners/b2b2]
    [HTTP request 1/1]
    [Response in frame: 26]
Line-based text data: application/x-www-form-urlencoded
    value=%7B%22runnerURL%22%3A%22http%3A%2F%2Flocal.example.com.com%22%2C%22runnerID%22%3A%221234567890%22%2C%22serverPort%22%3A8080%2C%22userPort%22%3A8000%7D

No.     Time           Source                Destination           Protocol Length Info
     26 4.545733000    10.10.0.15       192.168.1.130         HTTP     277    HTTP/1.1 307 Temporary Redirect 

Frame 26: 277 bytes on wire (2216 bits), 277 bytes captured (2216 bits) on interface 0
Ethernet II, Src: Cisco-Li_72:7e:65 (20:aa:4b:72:7e:65), Dst: Apple_7f:7d:30 (10:40:f3:7f:7d:30)
Internet Protocol Version 4, Src: 10.10.0.15 (10.10.0.15), Dst: 192.168.1.130 (192.168.1.130)
Transmission Control Protocol, Src Port: commplex-link (5001), Dst Port: 52369 (52369), Seq: 1, Ack: 355, Len: 211
Hypertext Transfer Protocol
    HTTP/1.1 307 Temporary Redirect\r\n
        [Expert Info (Chat/Sequence): HTTP/1.1 307 Temporary Redirect\r\n]
        Request Version: HTTP/1.1
        Status Code: 307
        Response Phrase: Temporary Redirect
    Location: http://10.10.0.15:5002/v2/keys/runners/b2b2\r\n
    Date: Wed, 29 Jan 2014 07:41:30 GMT\r\n
    Content-Length: 0\r\n
    Content-Type: text/plain; charset=utf-8\r\n
    Connection: close\r\n
    \r\n
    [HTTP response 1/1]
    [Time since request: 0.024000000 seconds]
    [Request in frame: 24]

No.     Time           Source                Destination           Protocol Length Info
     35 4.569726000    192.168.1.130         10.10.0.15       HTTP     193    GET /v2/keys/runners/b2b2 HTTP/1.1 

Frame 35: 193 bytes on wire (1544 bits), 193 bytes captured (1544 bits) on interface 0
Ethernet II, Src: Apple_7f:7d:30 (10:40:f3:7f:7d:30), Dst: Cisco-Li_72:7e:65 (20:aa:4b:72:7e:65)
Internet Protocol Version 4, Src: 192.168.1.130 (192.168.1.130), Dst: 10.10.0.15 (10.10.0.15)
Transmission Control Protocol, Src Port: 52370 (52370), Dst Port: rfe (5002), Seq: 1, Ack: 1, Len: 127
Hypertext Transfer Protocol
    GET /v2/keys/runners/b2b2 HTTP/1.1\r\n
        [Expert Info (Chat/Sequence): GET /v2/keys/runners/b2b2 HTTP/1.1\r\n]
        Request Method: GET
        Request URI: /v2/keys/runners/b2b2
        Request Version: HTTP/1.1
    Host: 10.10.0.15:5002\r\n
    accept-encoding: gzip, deflate\r\n
    Cookie: \r\n
    Connection: close\r\n
    \r\n
    [Full request URI: http://10.10.0.15:5002/v2/keys/runners/b2b2]
    [HTTP request 1/1]
    [Response in frame: 37]

No.     Time           Source                Destination           Protocol Length Info
     37 4.597459000    10.10.0.15       192.168.1.130         HTTP     306    HTTP/1.1 404 Not Found  (text/plain)

Frame 37: 306 bytes on wire (2448 bits), 306 bytes captured (2448 bits) on interface 0
Ethernet II, Src: Cisco-Li_72:7e:65 (20:aa:4b:72:7e:65), Dst: Apple_7f:7d:30 (10:40:f3:7f:7d:30)
Internet Protocol Version 4, Src: 10.10.0.15 (10.10.0.15), Dst: 192.168.1.130 (192.168.1.130)
Transmission Control Protocol, Src Port: rfe (5002), Dst Port: 52370 (52370), Seq: 1, Ack: 128, Len: 240
Hypertext Transfer Protocol
    HTTP/1.1 404 Not Found\r\n
        [Expert Info (Chat/Sequence): HTTP/1.1 404 Not Found\r\n]
        Request Version: HTTP/1.1
        Status Code: 404
        Response Phrase: Not Found
    Content-Type: text/plain; charset=utf-8\r\n
    X-Etcd-Index: 18\r\n
    Date: Wed, 29 Jan 2014 07:41:30 GMT\r\n
    Content-Length: 79\r\n
    Connection: close\r\n
    \r\n
    [HTTP response 1/1]
    [Time since request: 0.027733000 seconds]
    [Request in frame: 35]
Line-based text data: text/plain
    {"errorCode":100,"message":"Key not found","cause":"/runners/b2b2","index":18}\n

**Comment by defunctzombie** [comment]
There is a PR out to fix this.
